SpaceNavigator found
DEVICE ID 046d:c626 on Bus 001 Address 011 =================
 bLength                :   0x12 (18 bytes)
 bDescriptorType        :    0x1 Device
 bcdUSB                 :  0x200 USB 2.0
 bDeviceClass           :    0x0 Specified at interface
 bDeviceSubClass        :    0x0
 bDeviceProtocol        :    0x0
 bMaxPacketSize0        :   0x20 (32 bytes)
 idVendor               : 0x046d
 idProduct              : 0xc626
 bcdDevice              :  0x420 Device 4.2
 iManufacturer          :    0x1 3Dconnexion
 iProduct               :    0x2 Space Navigator
 iSerialNumber          :    0x0 
 bNumConfigurations     :    0x1
  CONFIGURATION 1: 100 mA ==================================
   bLength              :    0x9 (9 bytes)
   bDescriptorType      :    0x2 Configuration
   wTotalLength         :   0x29 (41 bytes)
   bNumInterfaces       :    0x1
   bConfigurationValue  :    0x1
   iConfiguration       :    0x0 
   bmAttributes         :   0x80 Bus Powered
   bMaxPower            :   0x32 (100 mA)
    INTERFACE 0: Human Interface Device ====================
     bLength            :    0x9 (9 bytes)
     bDescriptorType    :    0x4 Interface
     bInterfaceNumber   :    0x0
     bAlternateSetting  :    0x0
     bNumEndpoints      :    0x2
     bInterfaceClass    :    0x3 Human Interface Device
     bInterfaceSubClass :    0x0
     bInterfaceProtocol :    0x0
     iInterface         :    0x0 
      ENDPOINT 0x81: Interrupt IN ==========================
       bLength          :    0x7 (7 bytes)
       bDescriptorType  :    0x5 Endpoint
       bEndpointAddress :   0x81 IN
       bmAttributes     :    0x3 Interrupt
       wMaxPacketSize   :    0x8 (8 bytes)
       bInterval        :    0xa
      ENDPOINT 0x2: Interrupt OUT ==========================
       bLength          :    0x7 (7 bytes)
       bDescriptorType  :    0x5 Endpoint
       bEndpointAddress :    0x2 OUT
       bmAttributes     :    0x3 Interrupt
       wMaxPacketSize   :    0x8 (8 bytes)
       bInterval        :    0xa
cfg is    CONFIGURATION 1: 100 mA ==================================
   bLength              :    0x9 (9 bytes)
   bDescriptorType      :    0x2 Configuration
   wTotalLength         :   0x29 (41 bytes)
   bNumInterfaces       :    0x1
   bConfigurationValue  :    0x1
   iConfiguration       :    0x0 
   bmAttributes         :   0x80 Bus Powered
   bMaxPower            :   0x32 (100 mA)
    INTERFACE 0: Human Interface Device ====================
     bLength            :    0x9 (9 bytes)
     bDescriptorType    :    0x4 Interface
     bInterfaceNumber   :    0x0
     bAlternateSetting  :    0x0
     bNumEndpoints      :    0x2
     bInterfaceClass    :    0x3 Human Interface Device
     bInterfaceSubClass :    0x0
     bInterfaceProtocol :    0x0
     iInterface         :    0x0 
      ENDPOINT 0x81: Interrupt IN ==========================
       bLength          :    0x7 (7 bytes)
       bDescriptorType  :    0x5 Endpoint
       bEndpointAddress :   0x81 IN
       bmAttributes     :    0x3 Interrupt
       wMaxPacketSize   :    0x8 (8 bytes)
       bInterval        :    0xa
      ENDPOINT 0x2: Interrupt OUT ==========================
       bLength          :    0x7 (7 bytes)
       bDescriptorType  :    0x5 Endpoint
       bEndpointAddress :    0x2 OUT
       bmAttributes     :    0x3 Interrupt
       wMaxPacketSize   :    0x8 (8 bytes)
       bInterval        :    0xa
intf is      INTERFACE 0: Human Interface Device ====================
     bLength            :    0x9 (9 bytes)
     bDescriptorType    :    0x4 Interface
     bInterfaceNumber   :    0x0
     bAlternateSetting  :    0x0
     bNumEndpoints      :    0x2
     bInterfaceClass    :    0x3 Human Interface Device
     bInterfaceSubClass :    0x0
     bInterfaceProtocol :    0x0
     iInterface         :    0x0 
      ENDPOINT 0x81: Interrupt IN ==========================
       bLength          :    0x7 (7 bytes)
       bDescriptorType  :    0x5 Endpoint
       bEndpointAddress :   0x81 IN
       bmAttributes     :    0x3 Interrupt
       wMaxPacketSize   :    0x8 (8 bytes)
       bInterval        :    0xa
      ENDPOINT 0x2: Interrupt OUT ==========================
       bLength          :    0x7 (7 bytes)
       bDescriptorType  :    0x5 Endpoint
       bEndpointAddress :    0x2 OUT
       bmAttributes     :    0x3 Interrupt
       wMaxPacketSize   :    0x8 (8 bytes)
       bInterval        :    0xa
ep is        ENDPOINT 0x81: Interrupt IN ==========================
       bLength          :    0x7 (7 bytes)
       bDescriptorType  :    0x5 Endpoint
       bEndpointAddress :   0x81 IN
       bmAttributes     :    0x3 Interrupt
       wMaxPacketSize   :    0x8 (8 bytes)
       bInterval        :    0xa

Exit by pressing any button on the SpaceNavigator

入力待ち
   mode   = 0
push button :  1
Now Mode: 1
Received message on channel "EXAMPLE"
   mode   = 1
   R_list    = (0.0, 0.0, 0.0)
   Z_push    = 0.0

   mode   = 1
push button :  2
Now Mode: 0
Received message on channel "EXAMPLE"
   mode   = 0
   R_list    = (0.0, 0.0, 0.0)
   Z_push    = 0.0

   mode   = 0
push button :  1
Now Mode: 1
Received message on channel "EXAMPLE"
   mode   = 1
   R_list    = (0.0, 0.0, 0.0)
   Z_push    = 0.0

   mode   = 1
push button :  1
Now Mode: 2
Received message on channel "EXAMPLE"
   mode   = 2
   R_list    = (0.0, 0.0, 0.0)
   Z_push    = 0.0

   mode   = 2
push button :  1
Now Mode: 0
Received message on channel "EXAMPLE"
   mode   = 0
   R_list    = (0.0, 0.0, 0.0)
   Z_push    = 0.0

   mode   = 0
push button :  2
Now Mode: 2
Received message on channel "EXAMPLE"
   mode   = 2
   R_list    = (0.0, 0.0, 0.0)
   Z_push    = 0.0

R:  138 0 0
Pub R: [138, 0, 0]
Received message on channel "EXAMPLE"
   mode   = 2
   R_list    = (138.0, 0.0, 0.0)
   Z_push    = 0.0

R:  198 0 0
Pub R: [198, 0, 0]
Received message on channel "EXAMPLE"
   mode   = 2
   R_list    = (198.0, 0.0, 0.0)
   Z_push    = 0.0

R:  255 0 0
Pub R: [255, 0, 0]
Received message on channel "EXAMPLE"
   mode   = 2
   R_list    = (255.0, 0.0, 0.0)
   Z_push    = 0.0

R:  282 0 0
Pub R: [282, 0, 0]
Received message on channel "EXAMPLE"
   mode   = 2
   R_list    = (282.0, 0.0, 0.0)
   Z_push    = 0.0

R:  292 0 0
Pub R: [292, 0, 0]
Received message on channel "EXAMPLE"
   mode   = 2
   R_list    = (292.0, 0.0, 0.0)
   Z_push    = 0.0

R:  301 0 0
Pub R: [301, 0, 0]
Received message on channel "EXAMPLE"
   mode   = 2
   R_list    = (301.0, 0.0, 0.0)
   Z_push    = 0.0

R:  317 0 0
Pub R: [317, 0, 0]
Received message on channel "EXAMPLE"
   mode   = 2
   R_list    = (317.0, 0.0, 0.0)
   Z_push    = 0.0

R:  325 0 0
Pub R: [325, 0, 0]
Received message on channel "EXAMPLE"
   mode   = 2
   R_list    = (325.0, 0.0, 0.0)
   Z_push    = 0.0

R:  331 0 0
Pub R: [331, 0, 0]
Received message on channel "EXAMPLE"
   mode   = 2
   R_list    = (331.0, 0.0, 0.0)
   Z_push    = 0.0

R:  317 0 0
Pub R: [317, 0, 0]
Received message on channel "EXAMPLE"
   mode   = 2
   R_list    = (317.0, 0.0, 0.0)
   Z_push    = 0.0

R:  267 0 0
Pub R: [267, 0, 0]
Received message on channel "EXAMPLE"
   mode   = 2
   R_list    = (267.0, 0.0, 0.0)
   Z_push    = 0.0

R:  173 0 0
Pub R: [173, 0, 0]
Received message on channel "EXAMPLE"
   mode   = 2
   R_list    = (173.0, 0.0, 0.0)
   Z_push    = 0.0

R:  0 0 0
Pub R: [0, 0, 0]
Received message on channel "EXAMPLE"
   mode   = 2
   R_list    = (0.0, 0.0, 0.0)
   Z_push    = 0.0

R:  -122 0 0
Pub R: [-122, 0, 0]
Received message on channel "EXAMPLE"
   mode   = 2
   R_list    = (-122.0, 0.0, 0.0)
   Z_push    = 0.0

R:  -162 0 0
Pub R: [-162, 0, 0]
Received message on channel "EXAMPLE"
   mode   = 2
   R_list    = (-162.0, 0.0, 0.0)
   Z_push    = 0.0

R:  -197 0 0
Pub R: [-197, 0, 0]
Received message on channel "EXAMPLE"
   mode   = 2
   R_list    = (-197.0, 0.0, 0.0)
   Z_push    = 0.0

R:  -249 0 0
Pub R: [-249, 0, 0]
Received message on channel "EXAMPLE"
   mode   = 2
   R_list    = (-249.0, 0.0, 0.0)
   Z_push    = 0.0

R:  -315 0 0
Pub R: [-315, 0, 0]
Received message on channel "EXAMPLE"
   mode   = 2
   R_list    = (-315.0, 0.0, 0.0)
   Z_push    = 0.0

R:  -350 0 0
Pub R: [-350, 0, 0]
Received message on channel "EXAMPLE"